IP Address,DNS Name,Protocol,Port,Exploit?,Plugin Output,Synopsis,Description,Steps to Remediate,Risk Factor,CVE,First Discovered,Last Observed,Exploit Ease,Plugin Name,Family,Plugin,Severity,See Also,Vulnerability Priority Rating
10.20.1.234,web-prod-01,tcp,8009,Yes,AJP connector exposed,Apache Tomcat AJP Request Injection,AJP secret is not enforced,Patch Tomcat or disable AJP,Critical,CVE-2020-1938,2026-04-05,2026-07-31,Functional exploit exists,Apache Tomcat AJP Request Injection,Web Servers,100001,Critical,https://tomcat.apache.org/security-9.html,9.8
10.20.1.238,legacy-web-01,tcp,80,No,Server header disclosure,HTTP Server Type and Version Disclosure,The server discloses version information,Suppress server tokens,Low,,2025-10-01,2026-07-31,No known exploits,HTTP Server Type and Version Disclosure,Web Servers,100005,Low,https://httpd.apache.org/docs/2.4/mod/core.html,2.5
10.20.2.118,app-prod-02,tcp,8080,Yes,Log4j vulnerable class detected,Apache Log4j Remote Code Execution,The application includes a vulnerable Log4j version,Upgrade Log4j to a fixed release,Critical,CVE-2021-44228,2026-06-12,2026-07-31,Functional exploit exists,Apache Log4j Remote Code Execution,Web Servers,100006,Critical,https://logging.apache.org/log4j/2.x/security.html,10.0
10.20.3.50,sql-prod-03,tcp,1433,Yes,Unsupported SQL Server detected,Microsoft SQL Server Unsupported Version,SQL Server version is unsupported and vulnerable,Upgrade SQL Server to a supported version,Critical,,2026-07-05,2026-07-31,Functional exploit exists,Microsoft SQL Server Unsupported Version,Databases,100008,Critical,https://learn.microsoft.com/sql/sql-server/end-of-support,9.3
10.20.3.51,nginx-prod-01,tcp,443,No,Nginx package requires update,Nginx Security Update Available,The installed Nginx package is missing security fixes,Apply Nginx vendor updates,Medium,CVE-2025-2345,2026-07-08,2026-07-31,No known exploits,Nginx Security Update Available,Web Servers,100009,Medium,https://nginx.org/en/security_advisories.html,5.8
10.20.3.52,rdp-jump-01,tcp,3389,No,RDP service allows weak encryption,Remote Desktop Weak Encryption Enabled,The RDP service allows weak encryption settings,Enforce strong RDP encryption,High,,2026-07-12,2026-07-31,No known exploits,Remote Desktop Weak Encryption Enabled,Windows,100010,High,https://learn.microsoft.com/windows-server/remote/remote-desktop-services,7.0
